repo_id,repo_name,repo_url,stars,description,language,topics,tier,size_kb,ai_generation_score,core_intent,macro_category,micro_scenario,complexity_level,analytical_insight,analyzed_at,tokens_input,tokens_output,api_cost_cny,retry_count
1148313775,corboo/qp1-tools,https://github.com/corboo/qp1-tools,0,Audio-to-Video Generator + Spreaker Analytics Dashboard,HTML,[],silent,719,3,将音频文件自动转换为AI生成视频,产品与系统原型,content_creation,4,该项目体现了AI原生应用向多媒体内容创作领域的渗透，通过集成多个AI服务（Whisper、GPT-4、LTX Video）实现端到端的自动化内容生成，反映了低代码/无代码平台与AI API结合降低内容创作门槛的趋势。,2026-02-11T10:49:45.738038,2155,128,0.002411,0
1148164833,satyamprajapati4736-byte/skillshift-website,https://github.com/satyamprajapati4736-byte/skillshift-website,0,SkillShift – AI-based skill roadmap website,TypeScript,[],silent,234,5,AI技能路线图生成网站,产品与系统原型,education,3,该项目反映了AI原生应用开发门槛降低的趋势，开发者通过AI Studio等平台快速构建具备完整前后端的教育类产品原型，加速从创意到部署的验证周期。,2026-02-11T10:49:45.954607,1434,105,0.001644,0
1147718490,darkezy/ST,https://github.com/darkezy/ST,0,,HTML,[],silent,888,1,项目信息不足，无法判断,个人效能与辅助工具,other,1,该项目反映了开源生态中信息不完整或早期原型项目的普遍现象，可能暗示开发者快速创建仓库但未完善内容，或作为占位符使用。,2026-02-11T10:49:47.375196,1202,99,0.0014,0
1148215201,SmokyD2/Project-to-do,https://github.com/SmokyD2/Project-to-do,0,,HTML,[],silent,370,1,个人学习与教育实践,个人效能与辅助工具,education,1,该项目反映了开发者通过简单项目进行自我教育和技能练习的微观趋势，体现了开源社区中个人学习驱动的轻量级项目增长。,2026-02-11T10:49:47.547372,1222,93,0.001408,0
1148138190,ewakania/python_project_3,https://github.com/ewakania/python_project_3,0,,Python,[],silent,53,1,实现异步聊天室GUI,产品与系统原型,social,3,该项目反映了Python生态中异步编程与GUI框架结合的微趋势，用于快速原型化实时通讯工具，适合教育和实验场景。,2026-02-11T10:49:49.831690,1582,91,0.001764,0
1148250494,estebansanmartin/simulatore-traiettoria,https://github.com/estebansanmartin/simulatore-traiettoria,0,Simulatore Traiettoria Robotizzata,Python,"['abb', 'python', 'robotics']",silent,491,1,模拟工业机器人轨迹并生成控制代码,基础设施与底层组件,research,3,该项目反映了工业自动化领域向开源软件和离线模拟工具发展的趋势，以降低硬件测试成本和提升生产效率。,2026-02-11T10:49:50.050822,1624,90,0.001804,0
1148309487,artifact-keeper/artifact-keeper-ios,https://github.com/artifact-keeper/artifact-keeper-ios,1,"Artifact Keeper iOS app — SwiftUI, Swift 6",Swift,[],silent,1668,1,管理软件制品仓库的移动端应用,产品与系统原型,business_automation,5,该项目反映了企业级DevOps工具向移动端扩展的趋势，通过原生iOS/macOS应用提供对软件制品仓库的全面管理能力，体现了跨平台统一体验的需求。,2026-02-11T10:49:50.463176,4211,111,0.004433,0
1147592612,trahoangdev/server-j2ee-novawear,https://github.com/trahoangdev/server-j2ee-novawear,0,,Java,[],silent,134,1,构建电商后端API系统,产品与系统原型,ecommerce,4,该项目反映了教育场景中通过完整电商系统原型来学习企业级Java开发技术的趋势，体现了Spring Boot框架在学术项目中的广泛应用。,2026-02-11T10:49:51.880820,2894,98,0.00309,0
1148268945,Estoms/WilFit,https://github.com/Estoms/WilFit,0,,TypeScript,[],silent,155,5,基于Next.js模板的初始项目,产品与系统原型,other,1,反映了AI辅助开发工具（如Vercel AI模板）降低了项目启动门槛，使开发者能快速生成基础框架，但缺乏明确业务场景定义，体现了模板化项目的普及趋势。,2026-02-11T10:49:52.054325,1602,110,0.001822,0
1148292378,Kashy222/anuva-investments,https://github.com/Kashy222/anuva-investments,0,,JavaScript,[],silent,1228,5,创建React+Vite基础项目模板,基础设施与底层组件,other,1,该项目反映了开发者对快速启动React项目的需求，利用官方模板简化前端开发流程，体现了现代Web开发中工具链标准化和模板化的趋势。,2026-02-11T10:49:54.100413,1516,97,0.00171,0
1148087067,bino1999/healthcare-frontend-2,https://github.com/bino1999/healthcare-frontend-2,0,,JavaScript,[],silent,369,2,医院患者信息管理前端界面,产品与系统原型,health,3,该项目反映了医疗行业数字化转型中，开发者利用现代无头CMS（如Directus）快速构建专业应用原型的趋势，降低了医疗系统开发门槛。,2026-02-11T10:49:54.698707,2500,101,0.002702,0
1148217266,Sekharendu/Logistics-Operations-Hub,https://github.com/Sekharendu/Logistics-Operations-Hub,0,This is the Logistics Operation Hub Website,JavaScript,[],silent,1340,5,物流运营中心网站模板,产品与系统原型,business_automation,1,该项目反映了开发者利用AI生成工具快速搭建基础项目原型的趋势，降低了从零开始构建的门槛，但缺乏定制化内容，可能用于概念验证或学习目的。,2026-02-11T10:49:55.234981,1527,104,0.001735,0
1148263509,Unicycle-Declan/test_repo,https://github.com/Unicycle-Declan/test_repo,0,My first repo!,,[],silent,3955,1,测试GitHub仓库创建,个人效能与辅助工具,other,1,该项目反映了GitHub作为开发者入门平台，用户通过简单仓库创建来学习版本控制基础，体现了低门槛技术教育趋势。,2026-02-11T10:49:55.847601,1221,92,0.001405,0
1148161357,BoardingGate/BOLSA,https://github.com/BoardingGate/BOLSA,0,Gestos de cartera de valores iA,HTML,[],silent,2456,1,AI股票投资组合管理,产品与系统原型,fintech,3,该项目反映了AI在金融投资领域的应用趋势，开发者尝试将AI技术融入个人或小型投资组合管理，以自动化决策和优化资产配置。,2026-02-11T10:49:56.512456,1215,96,0.001407,0
1148406999,AndreKurait/jira-mcp-skill,https://github.com/AndreKurait/jira-mcp-skill,0,"One-command installer for Jira MCP skill - works with Kiro, Claude, Cursor",JavaScript,[],silent,71,3,一键配置AI代理的Jira集成,基础设施与底层组件,business_automation,2,该项目反映了AI代理工具生态的快速扩展，通过标准化配置流程降低企业级系统集成的门槛，推动AI辅助编程向更复杂的业务工作流渗透。,2026-02-11T10:49:58.781872,2828,104,0.003036,0
1148169802,jadnf/BetterTiermaker,https://github.com/jadnf/BetterTiermaker,0,Tiermaker but better,JavaScript,[],silent,369,1,创建无广告的层级列表制作工具,产品与系统原型,entertainment,3,该项目反映了开发者对现有在线工具（如TierMaker）进行去广告化改进的趋势，体现了用户对更纯净、定制化娱乐体验的需求，同时展示了React在快速构建交互式Web应用中的普及。,2026-02-11T10:49:59.225805,1264,114,0.001492,0
1148235796,kypflug/transmogrify-ext,https://github.com/kypflug/transmogrify-ext,0,,TypeScript,[],silent,1004,3,将网页转换为美观的阅读体验,产品与系统原型,productivity,5,该项目反映了AI原生应用向浏览器扩展渗透的趋势，通过多模型集成和云同步，将LLM能力无缝融入日常网页浏览，提升个人内容消费效率。,2026-02-11T10:50:00.484139,3371,102,0.003575,0
1147873396,eg0pr0xy/errorhead,https://github.com/eg0pr0xy/errorhead,0,A WebGL-powered real-time glitch engine featuring 30+ advanced signal manipulation systems — from compression corruption and macroblock destruction to temporal echo and motion sculpture.  Built for artists. Built for chaos.,TypeScript,"['datamoshing', 'distor', 'glitch', 'glitch-art', 'digital-art', 'error', 'errorhead']",silent,13070,1,在浏览器中实时生成故障艺术效果,产品与系统原型,content_creation,4,该项目反映了WebGL和浏览器技术成熟化趋势，使复杂图形处理无需依赖云服务或外部API，降低了数字艺术创作门槛，并体现了开源工具向专业艺术领域渗透的微观趋势。,2026-02-11T10:50:01.404920,1932,111,0.002154,0
1148400281,vinayprograms/agent,https://github.com/vinayprograms/agent,1,Headless LLM agent,Go,[],silent,9962,5,基于LLM的工作流自动化框架,基础设施与底层组件,research,4,该项目体现了AI原生开发范式的兴起，开发者通过纯AI对话（gramcoding）构建复杂系统，反映了低代码/无代码工具向专业工程领域渗透的趋势。,2026-02-11T10:50:02.585741,4318,106,0.00453,0
1147854443,Nmoiroux/ecoXCorr,https://github.com/Nmoiroux/ecoXCorr,0,An R package designed to explore lagged associations between environmental time series and ecological or epidemiological responses,R,[],silent,6960,1,分析环境与生态数据的滞后关联,基础设施与底层组件,research,4,该项目反映了开源科研工具向特定领域方法学封装的发展趋势，将复杂的统计建模流程标准化为可复用的R包，降低了生态学和流行病学研究的门槛。,2026-02-11T10:50:03.424833,3713,105,0.003923,0
1147888638,yancya/textbringer-tree-sitter,https://github.com/yancya/textbringer-tree-sitter,1,Tree-sitter's syntax highlighting plugin for Textbringer,Ruby,[],silent,148,1,为Textbringer编辑器提供语法高亮插件,基础设施与底层组件,productivity,3,该项目反映了开发者工具生态中，对更精确和可定制的语法高亮需求的增长，通过集成Tree-sitter解析器来提升代码编辑体验。,2026-02-11T10:50:03.587293,3099,103,0.003305,0
1147787038,PDA-AU/PF26,https://github.com/PDA-AU/PF26,0,,JavaScript,[],silent,12032,3,搭建全栈Web应用基础框架,产品与系统原型,other,4,该项目反映了开发者对快速构建全栈应用的需求，利用现代工具链（如React、FastAPI）和云服务（AWS、PostgreSQL）来简化开发流程，体现了低代码或模板化项目在加速原型验证中的趋势。,2026-02-11T10:50:05.365367,1642,116,0.001874,0
1147917801,aungwinthant/gitamix-frontend,https://github.com/aungwinthant/gitamix-frontend,0,Frontend Web App for Gitamix,TypeScript,[],silent,1370,1,构建Gitamix的前端界面,产品与系统原型,other,2,该项目反映了开发者利用现代前端工具链（如React、TypeScript、Vite）快速搭建产品原型的趋势，强调开发效率和代码质量，但缺乏具体业务逻辑，表明可能处于早期概念验证阶段。,2026-02-11T10:50:05.979737,1952,111,0.002174,0
1148230111,iptv2025tx/Otto-Live-ttva,https://github.com/iptv2025tx/Otto-Live-ttva,1,,Python,[],silent,40272,1,聚合直播电视播放列表链接,个人效能与辅助工具,entertainment,1,该项目反映了开源社区中用户生成内容（UGC）的持续流行，通过简单聚合和分享流媒体链接来满足娱乐需求，体现了去中心化内容分发的趋势。,2026-02-11T10:50:07.212171,2388,106,0.0026,0
1147879826,sattorovKamronbek/Lex-Project,https://github.com/sattorovKamronbek/Lex-Project,0,,HTML,[],silent,8473,1,未知项目意图,个人效能与辅助工具,other,1,该项目反映了开源生态中大量低信息量仓库的存在，可能源于测试、学习或占位目的，而非实际产品开发。,2026-02-11T10:50:07.342724,1215,90,0.001395,0
1148334736,team-unstablers/swift-msquic,https://github.com/team-unstablers/swift-msquic,0,"A Swift wrapper for MsQuic, providing prebuilt binaries and an idiomatic Swift API with async/await support.",C,"['msquic', 'quic', 'swift']",silent,11730,5,为Swift应用提供QUIC协议封装,基础设施与底层组件,other,4,该项目反映了AI辅助编程在底层网络协议封装领域的应用趋势，通过LLM生成复杂的系统级代码，加速了跨语言技术栈的集成。,2026-02-11T10:50:08.742278,3174,103,0.00338,0
1148044060,dylanayronrodgers-creator/dealerdashboard,https://github.com/dylanayronrodgers-creator/dealerdashboard,0,Openserve Dealer Dashboard,HTML,[],silent,829,1,管理光纤订单的经销商后台系统,产品与系统原型,business_automation,4,该项目反映了低代码/无代码工具（如Supabase）与前端框架结合，使中小企业能够快速构建定制化业务管理系统的趋势，降低了传统CRM系统的开发门槛。,2026-02-11T10:50:09.937957,2237,110,0.002457,0
1148321312,gregoriooliveira/GrupoMoura-main,https://github.com/gregoriooliveira/GrupoMoura-main,0,,JavaScript,[],silent,119,1,项目名称占位或未定义,个人效能与辅助工具,other,1,该项目反映了开源社区中大量低活跃度或未完成项目的存在，可能源于个人学习、测试或占位目的，而非实际产品开发。,2026-02-11T10:50:10.570156,1219,98,0.001415,0
1148345973,DragonFly504/DragonMailer2.0,https://github.com/DragonFly504/DragonMailer2.0,0,DragonMailer2.0 ,Python,[],silent,5957,2,批量发送邮件和短信,产品与系统原型,business_automation,4,该项目反映了低代码工具（如Streamlit）在快速构建企业级自动化应用中的普及趋势，以及开发者对集成云服务（如Azure）以增强功能的需求。,2026-02-11T10:50:11.245947,1958,103,0.002164,0
1148177971,CassiaPerez/CropLog,https://github.com/CassiaPerez/CropLog,0,,TypeScript,[],silent,731,5,部署AI Studio生成的应用程序,产品与系统原型,other,2,该项目反映了AI原生开发工具的普及趋势，开发者通过AI Studio等平台快速生成和部署应用，降低了原型构建门槛，推动了低代码/无代码与AI结合的发展。,2026-02-11T10:50:11.921426,1409,101,0.001611,0
1148314281,tronba/Delling,https://github.com/tronba/Delling,0,"A portable, browser-controlled emergency hub with offline knowledge (Kiwix), media server, SDR radio, and Meshtastic mesh communication. Runs on Orange Pi or Raspberry Pi.",Shell,[],silent,165,1,构建离线应急通信与媒体中心,产品与系统原型,personal,4,该项目反映了边缘计算与离线优先设计在应急场景中的兴起，结合开源硬件和软件定义无线电，推动去中心化通信和知识访问的微型化趋势。,2026-02-11T10:50:13.087270,3300,101,0.003502,0
1147968981,bonolo2s/Product-Management-Admin-Frontend,https://github.com/bonolo2s/Product-Management-Admin-Frontend,0,,TypeScript,[],silent,2211,1,产品管理后台前端界面,产品与系统原型,ecommerce,4,该项目反映了低代码/无代码工具普及下，开发者更专注于构建垂直领域（如电商）的完整产品原型，以快速验证业务逻辑和用户体验。,2026-02-11T10:50:13.794806,1388,99,0.001586,0
1147721097,NorthwoodsCommunityChurch/AVL-Dashboard,https://github.com/NorthwoodsCommunityChurch/AVL-Dashboard,0,"macOS system monitoring dashboard with menu bar agent — Bonjour discovery, live CPU/temp/network metrics, Tailscale support",Swift,"['macos', 'avl-tools']",silent,854,1,监控多台Mac系统性能并集中展示,个人效能与辅助工具,productivity,4,反映了开发者对本地网络设备监控的轻量化、可视化需求，以及Swift生态在系统工具开发中的成熟应用趋势。,2026-02-11T10:50:14.788572,3056,100,0.003256,0
1147832870,ticoraph/ReadyToSpendMonitor,https://github.com/ticoraph/ReadyToSpendMonitor,0,"Piloter la mise en production effective du modèle de scoring. Cela inclut la création d'une API robuste, la conteneurisation pour un déploiement fluide, et la mise en place d'un monitoring proactif pour garantir la performance et la fiabilité du modèle dans le temps.",Jupyter Notebook,[],silent,68632,2,部署和监控信用评分模型,产品与系统原型,fintech,4,该项目反映了MLOps在金融科技领域的普及趋势，企业正通过容器化、自动化监控和CI/CD管道将机器学习模型从实验环境快速转化为生产级服务，以提升模型部署的可靠性和可维护性。,2026-02-11T10:50:16.806328,2906,116,0.003138,0
1148403682,loguefx/Jellyfin_MetaData_Renamer,https://github.com/loguefx/Jellyfin_MetaData_Renamer,1,When Pressing the Identify Button on Jellyfin and save the new metadata it will rename the folder for the Series to have the correct naming conventions so the metadata gets picked up properly ,C#,[],silent,5834,1,自动重命名Jellyfin媒体库文件夹以匹配元数据,基础设施与底层组件,entertainment,3,该项目反映了媒体服务器生态中自动化元数据管理的需求增长，开发者通过插件化方式解决特定工作流痛点，体现了开源社区对专业工具精细化改进的趋势。,2026-02-11T10:50:17.175969,3863,112,0.004087,0
1148195832,TusharSariya/Terraform-Graph-Viewer,https://github.com/TusharSariya/Terraform-Graph-Viewer,0,"takes a Terraform plan and renders the graph, React & Flask",Python,[],silent,16104,3,可视化Terraform依赖图并支持自然语言查询,基础设施与底层组件,productivity,4,该项目反映了基础设施即代码（IaC）工具链向可视化与AI增强方向演进的趋势，通过自然语言接口降低DevOps工程师的认知负担。,2026-02-11T10:50:17.823665,1847,108,0.002063,0
1148016396,mamata5622/MERN04M008,https://github.com/mamata5622/MERN04M008,0,,HTML,[],silent,4800,1,MERN 技术栈学习或演示项目,产品与系统原型,education,2,该项目反映了开发者通过构建全栈原型来学习和掌握 MERN 技术栈的微观趋势，体现了开源社区中教育导向的实践驱动学习模式。,2026-02-11T10:50:17.823970,1219,100,0.001419,0
1148084013,nickustinov/itsytv-macos,https://github.com/nickustinov/itsytv-macos,251,The missing Apple TV remote app for macOS,Swift,[],signal,1779,1,在macOS菜单栏控制Apple TV,个人效能与辅助工具,personal,5,该项目反映了开发者对本地设备互联和自动化控制的持续需求，利用Apple原生协议（如Companion Link、AirPlay）构建专业级工具，体现了开源社区在填补官方应用功能空白方面的创新趋势。,2026-02-11T10:50:19.631431,3108,113,0.003334,0
1147837375,srivastavanandani190-lang/GFG-problems,https://github.com/srivastavanandani190-lang/GFG-problems,0,problem solution,C++,[],silent,106,1,整理GeeksforGeeks编程题解,个人效能与辅助工具,education,2,该项目反映了开发者通过公开代码库进行个人学习和技能展示的微观趋势，体现了编程教育资源的社区化共享和结构化整理需求。,2026-02-11T10:50:21.457144,1611,97,0.001805,0
1147745368,JackOfNoneTrades/AnExtraTouch,https://github.com/JackOfNoneTrades/AnExtraTouch,2,Small mod with visual features from mods like Dynamic Surroundings.,Java,[],silent,17903,1,为Minecraft 1.7.10添加视觉和音频增强,产品与系统原型,entertainment,3,该项目反映了游戏模组社区中向后兼容和定制化增强的持续需求，以及开源协作在复古游戏维护中的重要性。,2026-02-11T10:50:21.790822,2095,102,0.002299,0
1147732772,DovletEmin/Digital-Information-System-Microservices,https://github.com/DovletEmin/Digital-Information-System-Microservices,0,,TypeScript,[],silent,561,1,构建数字图书馆微服务架构,产品与系统原型,education,5,该项目反映了微服务架构在教育技术领域的应用趋势，展示了多语言技术栈（Node.js、Go、Python）与容器化部署（Docker）的现代软件工程实践，体现了复杂系统原型开发的模块化与可扩展性需求。,2026-02-11T10:50:22.705424,3890,120,0.00413,0
1148082531,kskreddy2k7/quiz-ai-app,https://github.com/kskreddy2k7/quiz-ai-app,0,,Python,[],silent,1065,3,利用AI生成个性化测验辅助学习,产品与系统原型,education,4,该项目反映了AI在教育领域的应用趋势，即通过多模态AI服务（如Gemini、HuggingFace）实现个性化学习工具的开发，同时采用PWA和跨平台部署（Web/Android）降低用户获取门槛。,2026-02-11T10:50:23.187062,3963,118,0.004199,0
1147606669,Adrielmedeiros01/TerapiasIntegrativas,https://github.com/Adrielmedeiros01/TerapiasIntegrativas,0,,HTML,[],silent,321,1,展示整合疗法相关信息,产品与系统原型,health,1,该项目反映了开发者利用简单网页技术快速构建健康主题原型的趋势，体现了低门槛工具在个人项目中的普及。,2026-02-11T10:50:23.571809,1224,88,0.0014,0
1148621307,Ashu20006/Video-Call-App,https://github.com/Ashu20006/Video-Call-App,0,,JavaScript,[],silent,76,1,实现视频通话功能,产品与系统原型,social,3,该项目反映了开发者对实时通信技术的兴趣，以及利用开源工具快速构建社交应用原型以验证想法的趋势。,2026-02-11T10:50:25.878296,1214,87,0.001388,0
1148418943,vango-go/vai-lite,https://github.com/vango-go/vai-lite,0,Multi-provider via RunStream(). Emits all other Vai features,Go,[],silent,32527,2,为Go开发者提供多AI供应商的SDK,基础设施与底层组件,research,4,反映了AI应用开发中多模型供应商集成的需求趋势，开发者需要统一接口来降低切换成本并提升开发效率。,2026-02-11T10:50:26.152030,2149,99,0.002347,0
1148960219,ethboi/automon,https://github.com/ethboi/automon,0,,TypeScript,[],silent,1195,3,区块链上的宝可梦风格对战游戏,产品与系统原型,entertainment,5,该项目反映了区块链游戏与AI代理结合的微观趋势，展示了去中心化娱乐应用如何集成智能合约和大型语言模型以增强用户体验和自动化玩法。,2026-02-11T10:50:27.013884,2714,101,0.002916,0
1149032128,anupam575/Social-Media,https://github.com/anupam575/Social-Media,0,,JavaScript,[],silent,6218,1,构建社交媒体平台或应用,产品与系统原型,social,3,该项目反映了开发者对构建社交媒体系统的持续兴趣，可能用于学习或原型验证，体现了开源社区中个人项目向产品化方向探索的趋势。,2026-02-11T10:50:27.425740,1211,94,0.001399,0
1148903296,giprahulss-maker/MRDRUGEEEDUPORTAL.github.io,https://github.com/giprahulss-maker/MRDRUGEEEDUPORTAL.github.io,1,FREE EDUCATION PORTAL,HTML,[],silent,3094,1,将WordPress网站转换为静态页面,产品与系统原型,education,1,该项目反映了静态网站生成和低成本部署的持续趋势，利用GitHub Pages简化教育内容的在线分发。,2026-02-11T10:50:27.425202,1309,88,0.001485,0
1149186782,Puqi7/MRVS_VideoSensemaking,https://github.com/Puqi7/MRVS_VideoSensemaking,0,CHI26_MRVS_project_page,JavaScript,[],silent,16067,1,为公共安全视频理解提供测试数据集和系统,产品与系统原型,research,4,该项目反映了学术界与工业界在机器人视频分析领域的交叉趋势，强调多机器人协作和公共安全应用，推动AI驱动的视频理解技术向实际场景落地。,2026-02-11T10:50:30.278825,1847,103,0.002053,0
1149100543,Bd-Mutant7/Habit-Tracker-App,https://github.com/Bd-Mutant7/Habit-Tracker-App,1,,TypeScript,[],silent,554,3,跨平台习惯追踪应用模板,产品与系统原型,personal,3,反映了低代码/无代码趋势下，开发者通过AI辅助快速生成跨平台应用原型，降低移动开发门槛，加速产品验证周期。,2026-02-11T10:50:30.586948,4120,99,0.004318,0
1148422755,researchersec/hltvy,https://github.com/researchersec/hltvy,0,,Python,[],silent,7673,1,自动收集CS:GO/CS2比赛赔率与结果数据,个人效能与辅助工具,research,3,反映了数据驱动决策在电竞领域的渗透趋势，以及开发者通过自动化脚本将公开数据转化为结构化研究资源的实践。,2026-02-11T10:50:31.150712,1636,102,0.00184,0
1149098948,Tate-T/zerniatko-project,https://github.com/Tate-T/zerniatko-project,0,,JavaScript,[],silent,983,5,提供React+Vite基础开发模板,基础设施与底层组件,other,1,反映了开发者对标准化前端开发工具链的依赖，以及AI辅助快速生成基础项目模板的趋势，降低了项目启动门槛。,2026-02-11T10:50:31.847590,1511,96,0.001703,0
1148683593,eval-exec/neomacs,https://github.com/eval-exec/neomacs,206,"🚀 Neomacs — A GPU-powered Emacs written in 🦀Rust with a modern display engine. Inline 🖼️4K images/🎥4K videos/🌐WPEWebKit using GPU acceleration, DMA-BUF, ZERO-COPY. Rich animation effects support. Aiming for modern design/multi-threaded Elisp and 100% Emacs compatibility. 🎉",Emacs Lisp,"['emacs', 'rust', 'neomacs', 'elisp', 'wgpu']",signal,64491,1,用Rust重写Emacs以支持GPU加速,基础设施与底层组件,productivity,5,反映了软件开发生态中，开发者正通过重写老旧系统（如Emacs）以利用现代硬件（GPU）和语言（Rust）来提升性能和用户体验的趋势，强调向后兼容性和渐进式重构。,2026-02-11T10:50:32.840392,4361,117,0.004595,0
1149081321,FundamentosDeAprendizajeSI3015/Juan_Manuel_Florez_Robledo,https://github.com/FundamentosDeAprendizajeSI3015/Juan_Manuel_Florez_Robledo,0,,Python,[],silent,1279,1,存储个人学习项目或作业,个人效能与辅助工具,education,1,该项目反映了教育领域中学生使用GitHub作为个人学习档案和作业提交平台的趋势，体现了代码托管工具在教育场景中的普及化应用。,2026-02-11T10:50:34.593678,1252,95,0.001442,0
1149116981,aetosset/agent-arena,https://github.com/aetosset/agent-arena,0,On-chain AI agent competition platform using Stacks + MCP,TypeScript,[],silent,1455,3,链上AI智能体竞技平台,产品与系统原型,entertainment,4,该项目反映了AI智能体与区块链技术融合的微观趋势，探索去中心化环境下的AI交互与竞争机制。,2026-02-11T10:50:35.737246,2744,97,0.002938,0
