repo_id,repo_name,repo_url,stars,description,language,topics,tier,size_kb,ai_generation_score,core_intent,macro_category,micro_scenario,complexity_level,analytical_insight,analyzed_at,tokens_input,tokens_output,api_cost_cny,retry_count
1146026775,wirsiyy/PORTFOLIO-main,https://github.com/wirsiyy/PORTFOLIO-main,0,,CSS,[],silent,2135,1,展示个人作品集,产品与系统原型,other,1,该项目反映了开发者通过简单静态网站快速构建个人品牌展示的趋势，体现了低代码或无代码工具在个人项目中的普及，但缺乏创新或复杂功能。,2026-02-11T10:43:28.702792,1219,96,0.001411,0
1145830058,Deadistor/Portfolio,https://github.com/Deadistor/Portfolio,0,,,[],silent,6030,1,构建个人作品集展示,产品与系统原型,other,1,该项目反映了开发者通过简单项目聚合展示个人技能的趋势，强调轻量级原型构建和快速迭代，符合现代软件开发生态中个人品牌建设和项目管理的需求。,2026-02-11T10:43:29.387750,1266,100,0.001466,0
1146168609,b101108063-ops/pocket_medicine,https://github.com/b101108063-ops/pocket_medicine,0,,Dart,[],silent,18951,1,提供腹痛评估的医疗辅助工具,产品与系统原型,health,2,该项目反映了医疗健康领域向移动端轻量化工具发展的趋势，结合Flutter框架，旨在通过AI辅助提升临床决策支持的可访问性。,2026-02-11T10:43:29.542218,1433,97,0.001627,0
1146042817,JohnSanmiguel1809/quickfirecalc,https://github.com/JohnSanmiguel1809/quickfirecalc,0,,HTML,[],silent,211,1,快速计算工具,个人效能与辅助工具,productivity,1,反映了开发者对轻量级、快速原型工具的偏好，体现了低代码或无代码趋势下个人工具开发的简化趋势。,2026-02-11T10:43:31.502192,1217,89,0.001395,0
1146043435,britt-young/standard-1,https://github.com/britt-young/standard-1,1,,JavaScript,[],silent,50887,1,提供React+Vite的快速启动模板,基础设施与底层组件,other,1,该项目反映了开发者对轻量级、现代化前端工具链的持续需求，以及模板化项目在加速开发流程中的基础作用。,2026-02-11T10:43:32.849374,1512,95,0.001702,0
1146050276,Park-Jeong-Gil/DDatgeSuvival,https://github.com/Park-Jeong-Gil/DDatgeSuvival,0,,TypeScript,[],silent,33182,5,创建Next.js默认模板项目,产品与系统原型,other,1,反映了AI辅助开发工具（如Vercel AI模板）的普及，降低了Web应用原型构建门槛，但项目缺乏定制化，凸显了AI生成代码在快速启动阶段的优势与内容空洞的局限性。,2026-02-11T10:43:33.616697,1617,110,0.001837,0
1145905036,serseopl/plugin11,https://github.com/serseopl/plugin11,0,d,PHP,[],silent,322,1,插件开发或测试,基础设施与底层组件,other,1,该项目反映了开源生态中大量低质量或未完成项目的存在，可能源于自动化工具生成或快速原型测试，凸显了维护和文档化的重要性。,2026-02-11T10:43:33.806634,1208,95,0.001398,0
1145592877,hikaruumeyama-png/vuln-agent,https://github.com/hikaruumeyama-png/vuln-agent,0,,Python,[],silent,193,5,自动解析漏洞邮件并通知负责人,产品与系统原型,business_automation,5,该项目反映了企业安全运维向AI代理自动化转型的趋势，将传统漏洞管理流程与Google Cloud的AI Agent Engine深度集成，体现了云原生AI在企业级自动化场景的落地应用。,2026-02-11T10:43:35.327011,5414,112,0.005638,0
1145927560,rohitdevsol/m8m,https://github.com/rohitdevsol/m8m,1,,TypeScript,[],silent,413,5,快速搭建Turborepo与Prisma的脚手架,基础设施与底层组件,other,2,反映了开发者对标准化、可复用的现代Web开发工具链模板的强烈需求，体现了AI辅助下快速生成基础设施代码的趋势。,2026-02-11T10:43:36.086133,2985,102,0.003189,0
1145709528,snrgapp/web-app,https://github.com/snrgapp/web-app,0,networking app ,TypeScript,[],silent,10938,2,交互式问题卡片抽选应用,产品与系统原型,entertainment,3,该项目体现了低代码/无代码趋势下，开发者利用现代全栈框架（如Next.js）和BaaS（如Supabase）快速构建交互式原型，以验证产品概念。,2026-02-11T10:43:38.051111,2105,108,0.002321,0
1145706191,anakalitha/smhs,https://github.com/anakalitha/smhs,0,Hospital Management Software for SMNH,TypeScript,[],silent,867,1,管理医院门诊患者信息,产品与系统原型,health,4,该项目反映了医疗行业数字化转型的趋势，开发者利用现代Web技术（如TypeScript和Vercel部署）构建定制化软件，以解决小型医疗机构的管理痛点，体现了软件即服务（SaaS）在垂直领域的普及。,2026-02-11T10:43:38.633609,1272,111,0.001494,0
1145644957,simonjeonsw/ai-system-spec,https://github.com/simonjeonsw/ai-system-spec,0,,Python,[],silent,708,5,自动化生成金融财经YouTube内容,产品与系统原型,content_creation,5,该项目体现了AI原生工作流从代码生成向完整业务系统设计的演进，将AI代理与规范驱动执行结合，反映了媒体内容生产向全自动化、可扩展的工业化模式转型的趋势。,2026-02-11T10:43:39.046243,1735,112,0.001959,0
1146009439,andreadifelice/tournament-manager-back,https://github.com/andreadifelice/tournament-manager-back,0,,PHP,[],silent,62,1,提供PHP REST API后端模板,基础设施与底层组件,other,2,反映了开发者对轻量级、可快速部署的后端模板的需求，体现了微服务架构和API优先开发趋势下，简化初始项目搭建的实践。,2026-02-11T10:43:39.690337,1712,102,0.001916,0
1146046233,vishaldadia19-maker/hello_flutter,https://github.com/vishaldadia19-maker/hello_flutter,0,Flutter iOS & Android app,Dart,[],silent,483,1,Flutter入门学习项目,产品与系统原型,education,1,该项目反映了开发者利用Flutter框架进行移动应用原型构建的入门趋势，体现了低代码或模板化项目在教育和学习场景中的普及。,2026-02-11T10:43:40.860247,1358,94,0.001546,0
1146165433,PrioaiCA/prioai-dashboard,https://github.com/PrioaiCA/prioai-dashboard,0,,HTML,[],silent,2049,1,展示AI优先级管理界面,产品与系统原型,productivity,1,该项目反映了AI工具向轻量化、可视化界面发展的趋势，开发者可能快速原型化AI应用以测试用户交互。,2026-02-11T10:43:42.024301,1217,90,0.001397,0
1146235169,ModernMube/OwnAudioVST3,https://github.com/ModernMube/OwnAudioVST3,0,OwnVst3 CSharp wrapper easy use plugin host ,C#,[],silent,4753,1,为C#开发者提供VST3插件封装库,基础设施与底层组件,content_creation,4,该项目反映了音频开发领域对跨平台、高性能中间件的持续需求，以及开源社区在专业工具链本地化封装方面的活跃贡献。,2026-02-11T10:43:43.245554,2457,105,0.002667,0
1146319131,RogueMaster/ProtoPirate,https://github.com/RogueMaster/ProtoPirate,30,Flipper Zero Protocol Pirate - work in progress by RocketGod,C,[],signal,352,1,解码汽车钥匙信号协议,基础设施与底层组件,research,4,该项目反映了物联网安全研究社区对硬件逆向工程的持续兴趣，以及开源工具在汽车安全协议分析领域的应用趋势。,2026-02-11T10:43:43.830258,2082,93,0.002268,0
1145614334,lusgro/places-viewer,https://github.com/lusgro/places-viewer,0,"Web interface for Google Places data with cards, table, and map views",TypeScript,[],silent,527,3,可视化展示Google Places数据,产品与系统原型,productivity,4,该项目反映了低代码/无代码工具（如Next.js、shadcn/ui）和AI辅助开发（如TypeScript、静态生成）的普及，使得开发者能快速构建数据驱动的Web应用原型，专注于业务逻辑而非底层实现。,2026-02-11T10:43:44.293242,1697,116,0.001929,0
1145606533,chefkjd/MixSplitR,https://github.com/chefkjd/MixSplitR,34,"""Automatically splits large mixes, identifies metadata, and organizes your unsorted and messy digitized music collection using audio fingerprinting""",Python,"['acrcloud', 'album-artwork', 'archival-tool', 'audio', 'audio-fingerprinting', 'audio-processing', 'flac', 'lossless-audio', 'metadata', 'music', 'music-organization', 'music-recognition', 'music-tagger', 'pydub', 'python', 'wav']",signal,769,1,自动分割音乐混音并识别元数据,个人效能与辅助工具,personal,4,该项目反映了个人数字资产管理工具向自动化、多源数据整合和完整工作流集成的趋势，体现了用户对私有化、可审计数据处理流程的需求增长。,2026-02-11T10:43:46.017892,3578,107,0.003792,0
1146178732,Isaiaarasan/Poster-Maker,https://github.com/Isaiaarasan/Poster-Maker,0,Simple Poster maker with customized theme by the Admin,JavaScript,[],silent,14877,2,创建可定制海报模板的Web应用,产品与系统原型,content_creation,4,该项目反映了低代码/无代码工具在内容创作领域的普及趋势，通过拖拽界面和模板化设计降低用户技术门槛，同时整合云服务实现快速部署。,2026-02-11T10:43:46.516456,1833,105,0.002043,0
1146091716,jennainoelina/FS_WS01,https://github.com/jennainoelina/FS_WS01,0,,HTML,[],silent,2324,1,完成一个工作坊任务,个人效能与辅助工具,education,1,该项目反映了教育领域通过简单代码实践促进技能学习的趋势，以及开发者利用GitHub作为学习记录和项目展示的常见做法。,2026-02-11T10:43:47.133406,1223,93,0.001409,0
1145839674,wisdomjerry/SAFE-TRACK,https://github.com/wisdomjerry/SAFE-TRACK,0,,TypeScript,[],silent,544,3,通过验证系统监控校车学生接送安全,产品与系统原型,business_automation,4,该项目反映了教育机构数字化转型中，利用轻量级全栈技术栈（React+Node+Supabase）快速构建垂直领域安全监控系统的趋势，特别是在资源有限地区通过标准化流程提升运营透明度。,2026-02-11T10:43:48.643179,1929,118,0.002165,0
1145631839,LavieNroseee/web,https://github.com/LavieNroseee/web,0,,JavaScript,[],silent,82,5,提供React+Vite基础开发模板,基础设施与底层组件,other,1,该项目反映了AI原生开发工具（如Vercel AI SDK模板）的普及趋势，开发者通过一键生成标准化项目模板来快速启动开发，降低了前端工程化的入门门槛。,2026-02-11T10:43:49.182832,1509,108,0.001725,0
1145741281,BessyPBabu/Carbonsentry-frontend,https://github.com/BessyPBabu/Carbonsentry-frontend,0,,JavaScript,[],silent,386,1,集中管理碳合规文档与供应商,产品与系统原型,business_automation,4,该项目反映了企业级合规自动化趋势，通过数字化工具解决环境、社会和治理（ESG）报告中的手动流程痛点，推动可持续性管理向标准化和可审计方向发展。,2026-02-11T10:43:50.990540,1597,106,0.001809,0
1145616667,adhavle-aws/ict-mcp-server,https://github.com/adhavle-aws/ict-mcp-server,0,,Python,[],silent,68671,5,将自然语言转换为AWS基础设施代码,产品与系统原型,business_automation,5,该项目体现了AI原生基础设施即代码的趋势，通过MCP协议将大模型能力封装为标准化工具，降低云架构设计门槛。,2026-02-11T10:43:51.541522,3512,101,0.003714,0
1146048272,blaix/growth,https://github.com/blaix/growth,0,A Pretty Nice Self-Improvement App,Nix,[],silent,243,1,个人自我提升应用,产品与系统原型,personal,3,该项目反映了开发者利用Nix Flakes等现代工具链构建可复现、可部署的个人应用的趋势，强调自我管理和隐私控制，体现了开源软件向个人生活管理领域的渗透。,2026-02-11T10:43:51.638359,1857,102,0.002061,0
1146006621,outscale/gli,https://github.com/outscale/gli,0,Experimental CLI for Outscale,Go,"['maturity-sandbox', 'renovate']",silent,73,1,为Outscale云服务提供命令行接口,基础设施与底层组件,research,4,该项目反映了云服务提供商通过开源CLI工具降低API使用门槛、提升开发者体验的趋势，同时展示了现代CLI工具向智能化（如自动补全、jq过滤）和易用性发展的方向。,2026-02-11T10:43:54.219197,3698,116,0.00393,0
1145974131,mr-kushnir/inv,https://github.com/mr-kushnir/inv,0,Invoice Bot - Telegram bot for invoicing,Python,[],silent,236,3,通过Telegram机器人自动化开具发票,产品与系统原型,business_automation,4,该项目体现了企业流程自动化向轻量化、即时通讯平台迁移的趋势，结合云原生架构（如YDB Serverless）降低运维门槛，反映了SMB（中小型企业）对低成本、易部署的SaaS工具需求增长。,2026-02-11T10:43:54.576663,2938,122,0.003182,0
1146748787,Lil-002/Rock-Classification,https://github.com/Lil-002/Rock-Classification,0,ML ,Jupyter Notebook,[],silent,1385,1,用机器学习分析火山岩年龄与化学成分,基础设施与底层组件,research,3,该项目反映了数据科学在传统地质学领域的渗透趋势，展示了机器学习方法如何被用于解决特定领域的专业分析问题，体现了AI工具在学术研究中的实用化应用。,2026-02-11T10:43:56.595486,2461,107,0.002675,0
1146639910,ezzerman12345/addon,https://github.com/ezzerman12345/addon,0,,,[],silent,26620,1,仓库名称和README内容不足,基础设施与底层组件,other,1,该项目反映了开源生态中大量低活跃度或未完成仓库的存在，可能源于个人实验、占位或废弃项目，凸显了GitHub上项目质量参差不齐的现状。,2026-02-11T10:43:56.654838,1209,104,0.001417,0
1145888859,valantic-CEC-Deutschland-GmbH/workoflow-integration-platform,https://github.com/valantic-CEC-Deutschland-GmbH/workoflow-integration-platform,0,,PHP,[],silent,4131,3,企业AI代理与业务系统集成平台,产品与系统原型,business_automation,5,该项目反映了企业级AI代理从孤立工具向集成化平台演进的趋势，强调数据主权与多租户安全，体现了AI在企业工作流中从辅助角色向核心基础设施的转变。,2026-02-11T10:43:56.946566,3817,115,0.004047,0
1146372908,Baxxyo/Web2,https://github.com/Baxxyo/Web2,0,project web2,HTML,[],silent,12944,1,创建基础网页项目,产品与系统原型,other,1,该项目反映了开源社区中大量简单、未完成或实验性项目的存在，可能用于学习或快速原型测试，而非成熟产品开发。,2026-02-11T10:43:58.674360,1216,92,0.0014,0
1146496968,soeparnocorp/room,https://github.com/soeparnocorp/room,0,,HTML,[],silent,294,1,演示Cloudflare Workers实时聊天技术,基础设施与底层组件,social,3,该项目反映了边缘计算平台向状态化服务演进的技术趋势，通过Durable Objects实现传统上难以在无服务器架构中处理的实时协调场景，展示了边缘基础设施能力的扩展。,2026-02-11T10:43:59.338843,2580,107,0.002794,0
1146592725,VIGHNESH1510/VERILOG,https://github.com/VIGHNESH1510/VERILOG,0,,Verilog,[],silent,1471,1,存储Verilog代码示例或项目,基础设施与底层组件,research,2,该项目反映了硬件描述语言（HDL）在开源社区中的持续应用，以及开发者对数字电路设计基础知识的分享趋势，可能用于教育或实验目的。,2026-02-11T10:44:01.031598,1214,99,0.001412,0
1146691888,Drill23/pi-usage-monitor,https://github.com/Drill23/pi-usage-monitor,0,,HTML,[],silent,857,1,监控树莓派使用情况,个人效能与辅助工具,personal,2,该项目反映了物联网设备监控的轻量化趋势，开发者倾向于构建简单工具来管理个人硬件资源，体现了DIY和开源文化在智能家居领域的普及。,2026-02-11T10:44:01.548114,1214,98,0.00141,0
1146764807,mrsaurav564-ui/cafe-app,https://github.com/mrsaurav564-ui/cafe-app,0,,TypeScript,[],silent,3485,1,模拟咖啡馆点餐与厨房管理系统,产品与系统原型,ecommerce,4,该项目反映了低代码/原型工具普及下，开发者能快速构建具备完整前后端交互的行业应用原型，用于验证商业模式或技术栈选型。,2026-02-11T10:44:02.052053,1646,104,0.001854,0
1146369773,coCHELOice/lumen-arkhe,https://github.com/coCHELOice/lumen-arkhe,0,sitio revista,Roff,[],silent,77554,5,创建基础网站模板,基础设施与底层组件,other,1,该项目反映了AI原生开发工具（如Astro）降低网站构建门槛的趋势，使开发者能快速生成标准化项目结构，但缺乏个性化定制。,2026-02-11T10:44:03.534460,1644,98,0.00184,0
1146346705,MaximWerner0207/3dAssets,https://github.com/MaximWerner0207/3dAssets,0,,,[],silent,19324,1,存储3D模型资产,基础设施与底层组件,content_creation,1,该项目反映了开发者对3D内容创作工具链中资产管理的需求，体现了数字内容创作生态中资产共享和版本控制的趋势。,2026-02-11T10:44:03.620767,1216,94,0.001404,0
1146846864,Dicklesworthstone/frankentui,https://github.com/Dicklesworthstone/frankentui,122,"The Most Powerful, Performant, and Stylish TUI Framework on the Planet",Rust,[],signal,51538,1,构建无闪烁、确定性的终端UI内核,基础设施与底层组件,other,5,反映了开发者对终端UI框架在正确性、性能和可维护性上的更高要求，推动了底层工具向专业化、模块化方向发展。,2026-02-11T10:44:05.741304,4693,96,0.004885,0
1146611198,redchoeng/stock-recommendations,https://github.com/redchoeng/stock-recommendations,0,,HTML,[],silent,873,2,基于量化策略和新闻情感分析的股票推荐,产品与系统原型,fintech,4,该项目反映了金融科技领域AI与传统量化策略融合的趋势，通过自动化数据分析和实时通知降低个人投资门槛，体现了开源工具在专业场景中的平民化应用。,2026-02-11T10:44:06.794234,2070,103,0.002276,0
1146749160,joba-1/Joba_Esp32,https://github.com/joba-1/Joba_Esp32,0,,C++,[],silent,579,1,ESP32物联网数据采集与自动化框架,基础设施与底层组件,personal,5,该项目反映了物联网领域向模块化、标准化和低代码配置发展的趋势，通过统一框架简化了智能家居和工业数据采集的部署复杂度。,2026-02-11T10:44:07.582299,4168,102,0.004372,0
1146786511,prixe-api/prixe-status-page,https://github.com/prixe-api/prixe-status-page,0,📈 Prixe Status Page powered by @upptime,CSS,"['status-page', 'upptime', 'uptime-monitor']",silent,14711,1,监控API服务状态并展示,基础设施与底层组件,business_automation,2,该项目反映了开源监控工具（如Upptime）的普及趋势，使开发者能快速部署状态页面，降低运维成本，体现了基础设施即代码和自动化监控的微服务生态发展。,2026-02-11T10:44:08.348687,2326,108,0.002542,0
1146755999,DiglyAI/DiglyAI,https://github.com/DiglyAI/DiglyAI,0,DiglyAI monorepo with Digly Runtime and core modules,TypeScript,[],silent,309,3,通过YAML定义业务逻辑的运行时环境,基础设施与底层组件,business_automation,4,反映了低代码/无代码平台向多语言运行时演进的趋势，通过声明式YAML配置降低业务逻辑实现门槛，同时支持AI友好型开发流程。,2026-02-11T10:44:08.984468,2628,110,0.002848,0
1146831044,xiaofeng-c/PicGoPictureBed,https://github.com/xiaofeng-c/PicGoPictureBed,0,,,[],silent,2087,1,管理图片上传到图床,个人效能与辅助工具,productivity,2,该项目反映了开发者对个人工作流自动化的持续关注，尤其是在内容管理和跨平台同步方面，体现了轻量化工具在提升日常效率中的流行趋势。,2026-02-11T10:44:09.968302,1215,99,0.001413,0
1146890534,patmonardo/organon,https://github.com/patmonardo/organon,0,,Rust,[],silent,6390,1,构建执行与规划分离的软件架构,基础设施与底层组件,research,5,该项目反映了软件架构中执行与规划分离的趋势，强调Rust用于高性能内核和TypeScript用于上层逻辑，体现了多语言协作和模块化设计在复杂系统开发中的重要性。,2026-02-11T10:44:11.985930,2857,106,0.003069,0
1146883183,Haeyzed/ecommerece-frontend,https://github.com/Haeyzed/ecommerece-frontend,0,,TypeScript,[],silent,1015,5,构建电商前端界面,产品与系统原型,ecommerce,2,该项目反映了AI辅助开发工具（如Vercel AI模板）降低前端开发门槛的趋势，使开发者能快速生成具备现代框架（Next.js）和部署能力的产品原型，加速电商类应用的验证周期。,2026-02-11T10:44:12.427830,1705,113,0.001931,0
1146837974,WolcenOn/PictoUtils,https://github.com/WolcenOn/PictoUtils,0,Aplicación para creación de materiales didácticos baso en los pictogramas de AARASAC y la generación de voces de Google.,HTML,[],silent,805,1,基于AARASAC图片和Google语音生成教学材料,产品与系统原型,education,3,该项目反映了教育技术领域对AI辅助内容生成的趋势，结合开源资源（如AARASAC图片）和云服务（如Google语音）来简化教学材料制作，体现了低代码工具在教育场景的普及。,2026-02-11T10:44:13.317633,1276,117,0.00151,0
1146866961,florentdeborde/fertenergie,https://github.com/florentdeborde/fertenergie,0,Site web de Ferténergie,JavaScript,[],silent,24221,1,展示可再生能源集体网站,产品与系统原型,other,3,该项目反映了开源社区中公民集体利用现代前端技术栈（如React、Vite）快速构建和部署静态网站的趋势，以低成本方式推广社会和环境倡议。,2026-02-11T10:44:13.421942,2071,98,0.002267,0
1146706399,umgap2026-cmd/UMGAP-AI,https://github.com/umgap2026-cmd/UMGAP-AI,0,,HTML,[],silent,2176,1,项目信息不足，无法判断,基础设施与底层组件,other,1,该项目反映了开源项目中信息缺失的常见问题，可能表明开发者未充分维护或项目处于早期阶段，这提醒了在AI辅助开发时代，清晰的文档和元数据对于项目可发现性和协作的重要性。,2026-02-11T10:44:14.910952,1222,109,0.00144,0
1146515208,DenizzOzder/Ecommerce,https://github.com/DenizzOzder/Ecommerce,0,,TypeScript,[],silent,64,1,练习TypeScript与React-Redux开发,产品与系统原型,ecommerce,2,该项目反映了开发者通过构建电商原型来学习现代前端技术栈（如TypeScript和React-Redux）的微观趋势，体现了实践驱动学习在软件开发中的普及。,2026-02-11T10:44:17.086813,1219,105,0.001429,0
1146691564,dive-8978/astro-channel,https://github.com/dive-8978/astro-channel,0,,HTML,[],silent,11013,1,空投代币验证与分发系统,产品与系统原型,fintech,4,该项目反映了加密货币领域空投活动技术栈的标准化趋势，结合后端API与智能合约实现自动化分发，体现了区块链应用向轻量级、可扩展解决方案的发展。,2026-02-11T10:44:17.105183,1553,104,0.001761,0
1146724953,igapyon/starship-sim,https://github.com/igapyon/starship-sim,0,🧪 Experimental 2D space battle simulation. Physics-based com combat in your browser using HTML5 Canvas.,HTML,"['javascript', 'staticwebapp', 'browser-game', 'single-file', 'space-battle', 'vanilla-js', 'vanilla-js-game']",silent,643,1,实现浏览器中的2D太空战斗物理模拟,产品与系统原型,entertainment,4,该项目反映了开发者对轻量化、教育性游戏原型的追求，体现了单文件应用在复杂交互场景中的可行性，以及开源社区对透明、可学习代码结构的重视。,2026-02-11T10:44:18.580255,5264,111,0.005486,0
1146682737,giquina/aws-clawd-bot,https://github.com/giquina/aws-clawd-bot,0,"WhatsApp AI Assistant - 24/7 bot with persistent memory, skills framework, GitHub integration, and scheduler",JavaScript,[],silent,1790,3,通过AI代理自动化编程任务,产品与系统原型,productivity,5,该项目体现了AI代理从单纯代码生成向全流程自动化管理的演进趋势，将多模态交互、智能路由与持久化工作流结合，展示了AI原生开发工具向企业级应用场景的渗透。,2026-02-11T10:44:18.924177,3982,113,0.004208,0
1146899180,MohamedAttawiya/ewtrading-hugo,https://github.com/MohamedAttawiya/ewtrading-hugo,0,,HTML,[],silent,35130,1,为贸易公司构建静态网站,产品与系统原型,ecommerce,2,反映了企业采用静态站点生成器（如Hugo）结合云部署（Netlify）来快速构建低成本、高性能网站的趋势，同时通过保留特定静态文件（如contact.html）来兼容传统CRM系统，体现了混合新旧技术的实用主义开发模式。,2026-02-11T10:44:25.330951,1558,125,0.001808,0
1146778569,groovyrey/nexo,https://github.com/groovyrey/nexo,0,,TypeScript,[],silent,3030,5,创建Next.js应用模板,产品与系统原型,other,1,该项目反映了AI辅助开发工具（如Vercel AI模板）的普及，使得开发者能快速生成标准化项目框架，加速原型构建和验证过程。,2026-02-11T10:44:26.815303,1605,97,0.001799,0
1146754914,battle-buddy-games/Platform,https://github.com/battle-buddy-games/Platform,0,,JavaScript,[],silent,3187,1,游戏平台网关服务,产品与系统原型,entertainment,3,该项目反映了游戏开发中轻量级网关服务的趋势，可能用于简化多游戏集成或实时交互，体现模块化架构在娱乐领域的应用。,2026-02-11T10:44:26.880357,1215,96,0.001407,0
1146919548,rbrabson/ftcstanding,https://github.com/rbrabson/ftcstanding,0,,Go,[],silent,23907,1,管理FIRST科技挑战赛的竞赛数据,基础设施与底层组件,other,4,该项目反映了开源社区对特定垂直领域（如教育竞赛）数据管理工具的需求，以及开发者对多后端架构（SQL与文件存储）灵活性的重视。,2026-02-11T10:44:28.208645,3847,106,0.004059,0
1146728579,expresCocina/CrmVidaDigitalcol,https://github.com/expresCocina/CrmVidaDigitalcol,0,,TypeScript,[],silent,273,3,企业客户关系管理与销售自动化,产品与系统原型,business_automation,5,该项目反映了企业级应用向低代码/无代码平台（如Supabase）与AI服务（如OpenAI）深度集成的趋势，通过标准化组件快速构建全功能CRM系统，降低开发门槛。,2026-02-11T10:44:28.439950,3969,116,0.004201,0
