repo_id,repo_name,repo_url,stars,description,language,topics,tier,size_kb,ai_generation_score,core_intent,macro_category,micro_scenario,complexity_level,analytical_insight,analyzed_at,tokens_input,tokens_output,api_cost_cny,retry_count
1150849699,Maireg789/brent-oil-change-point-analysis,https://github.com/Maireg789/brent-oil-change-point-analysis,0,Bayesian change point detection and statistical modeling of Brent oil prices to quantify the impact of geopolitical and economic events for Birhan Energies.,Jupyter Notebook,[],silent,1171,1,分析布伦特油价变化点以量化事件影响,产品与系统原型,research,4,该项目反映了数据科学在能源金融领域的应用趋势，结合贝叶斯统计和事件驱动分析，以支持企业决策。,2026-02-11T10:55:00.542761,1421,96,0.001613,0
1150911038,mancloud-rocket/web-rocketbot-v2,https://github.com/mancloud-rocket/web-rocketbot-v2,0,,TypeScript,[],silent,77363,5,展示RPA产品能力的交互式网站,产品与系统原型,business_automation,4,该项目反映了AI辅助开发工具（如Antigravity）在加速复杂前端原型构建中的应用趋势，以及企业营销向沉浸式、交互式体验的转变。,2026-02-11T10:55:00.716656,2967,104,0.003175,0
1150233119,wollisellis/nextnutri-bodycomp-mvp,https://github.com/wollisellis/nextnutri-bodycomp-mvp,0,,Python,[],silent,129,2,通过照片估算体脂百分比,产品与系统原型,health,4,该项目反映了AI在健康领域从传统医疗设备向轻量化、可访问的原型应用扩展的趋势，结合计算机视觉和启发式算法，服务于专业教育和筛查场景。,2026-02-11T10:55:01.032809,1937,101,0.002139,0
1150689555,mukeshkumar7848/limit,https://github.com/mukeshkumar7848/limit,0,,TypeScript,[],silent,204,5,创建Next.js默认模板项目,产品与系统原型,other,1,该项目反映了AI辅助开发工具（如Vercel AI模板）的普及，使得开发者能快速生成标准化项目框架，但缺乏定制化内容，凸显了低代码趋势下原型构建的便捷性与同质化风险。,2026-02-11T10:55:02.461964,1612,113,0.001838,0
1150667342,SherineAwad/NFI_multiomics,https://github.com/SherineAwad/NFI_multiomics,0,,Python,[],silent,20656,1,分析NFI小分子多组学数据,基础设施与底层组件,research,3,该项目反映了生物信息学中单细胞多组学分析的开源研究趋势，展示了学术界对复杂生物数据整合与可视化的需求增长。,2026-02-11T10:55:04.663119,3323,102,0.003527,0
1150848321,chrwx4coffee/wa-assistant,https://github.com/chrwx4coffee/wa-assistant,0,,JavaScript,[],silent,101,2,通过Excel和WhatsApp Web批量发送个性化消息,个人效能与辅助工具,business_automation,4,该项目反映了低代码自动化工具在个人和小型企业场景中的普及趋势，结合了桌面应用框架（Electron）和第三方API（WhatsApp Web）来简化批量通信流程。,2026-02-11T10:55:04.863310,2762,111,0.002984,0
1150904467,NewmanB1/AGNI,https://github.com/NewmanB1/AGNI,0,Ed Tech,JavaScript,[],silent,258,1,为离线教育创建标准文件格式,基础设施与底层组件,education,4,该项目反映了边缘计算与去中心化教育技术的融合趋势，通过轻量级标准解决数字鸿沟问题，体现了对硬件资源受限场景的深度优化。,2026-02-11T10:55:05.325518,2067,104,0.002275,0
1150669462,ramicheAi/ramiche-site,https://github.com/ramicheAi/ramiche-site,0,,TypeScript,[],silent,2788,3,为个人工作流提供本地优先的自动化界面,个人效能与辅助工具,productivity,3,该项目反映了本地优先和AI辅助工具在个人生产力领域的融合趋势，强调自动化界面而非后端集成，符合开发者对轻量级、定制化工作流管理的需求。,2026-02-11T10:55:05.530380,1343,107,0.001557,0
1150907068,amine31-dz/iaexpo2026,https://github.com/amine31-dz/iaexpo2026,0,,HTML,[],silent,35286,1,部署静态网站模板,基础设施与底层组件,other,1,该项目反映了低代码或无代码工具在静态网站生成中的普及趋势，开发者倾向于使用预构建模板快速部署基础网页，以简化前端开发流程。,2026-02-11T10:55:06.261401,1353,95,0.001543,0
1150557537,bjornodinsson89/discord-file-system,https://github.com/bjornodinsson89/discord-file-system,0,test repo,Python,[],silent,695,1,为Discord服务器提供自动化管理功能,产品与系统原型,social,4,该项目反映了开发者利用Discord作为轻量级SaaS平台，通过机器人实现社区自动化管理的趋势，结合数据库和配置系统构建可扩展的社交工具。,2026-02-11T10:55:09.270774,1737,105,0.001947,0
1150448596,Pranav-Official/kabang,https://github.com/Pranav-Official/kabang,0,,TypeScript,[],silent,417,2,自托管可定制搜索快捷系统,个人效能与辅助工具,productivity,4,反映了开发者对数据主权和个性化工作流的追求，将DuckDuckGo等平台的便捷功能私有化部署，符合去中心化和自托管工具的趋势。,2026-02-11T10:55:09.557098,4306,106,0.004518,0
1150605932,Kanth-eri/crudprojedata,https://github.com/Kanth-eri/crudprojedata,0,,TypeScript,[],silent,11382,1,构建一个CRUD应用原型,产品与系统原型,other,3,该项目反映了开发者利用现代全栈技术（如Quarkus、Bun）快速构建可运行原型的趋势，强调后端与前端分离的架构实践。,2026-02-11T10:55:09.646904,1446,99,0.001644,0
1150313815,tk-425/Quota-Checker,https://github.com/tk-425/Quota-Checker,0,Antigravity IDE Quota Tracker Extension,TypeScript,[],silent,104,1,监控Antigravity配额使用情况,个人效能与辅助工具,productivity,3,反映了AI开发工具生态中，开发者对资源监控和管理的需求催生了轻量级辅助工具的趋势，体现了工具链的细分化。,2026-02-11T10:55:10.547839,2116,102,0.00232,0
1150740263,dachzay/zachday-site,https://github.com/dachzay/zachday-site,0,,HTML,[],silent,348,1,创建个人网站展示作品,产品与系统原型,personal,2,该项目反映了静态网站生成和云部署的普及趋势，开发者倾向于使用无构建步骤的简单技术栈（如HTML/CSS/JavaScript）结合云平台（如Cloudflare Pages）快速部署个人网站，体现了低代码和高效部署的微观趋势。,2026-02-11T10:55:10.960891,1457,118,0.001693,0
1150513769,nazisharifi2025/BookStoreApi,https://github.com/nazisharifi2025/BookStoreApi,0,,Blade,[],silent,93,1,构建图书管理API,产品与系统原型,ecommerce,3,该项目反映了开发者利用成熟框架（如Laravel）快速构建业务原型的学习与实践趋势，体现了低门槛API开发工具的普及。,2026-02-11T10:55:13.483895,2255,96,0.002447,0
1150840894,anastasiia0711-p/DevMriya,https://github.com/anastasiia0711-p/DevMriya,0,,HTML,[],silent,5995,1,未知项目意图,个人效能与辅助工具,other,1,该项目反映了开源生态中大量低活跃度或未完成项目的存在，可能源于个人实验或学习目的，缺乏明确业务逻辑和文档，难以评估实际价值。,2026-02-11T10:55:14.338774,1218,98,0.001414,0
1150858523,web-dev-vishal/Global_Fi_Ultra,https://github.com/web-dev-vishal/Global_Fi_Ultra,3,,JavaScript,[],silent,276,3,聚合多源金融数据并提供AI分析,产品与系统原型,fintech,5,该项目反映了金融科技领域向实时数据聚合与AI增强分析融合的趋势，以及开发者利用AI API快速构建专业级金融工具的能力提升。,2026-02-11T10:55:14.484955,4159,102,0.004363,0
1150591163,tomarvanshika2012-dotcom/AI_BASED_CHILD_SAFETY_,https://github.com/tomarvanshika2012-dotcom/AI_BASED_CHILD_SAFETY_,0,,Python,[],silent,132,1,基于AI的儿童安全保护,产品与系统原型,personal,1,该项目反映了AI技术向个人生活安全领域渗透的微观趋势，但当前实现可能较为初步，缺乏详细功能说明。,2026-02-11T10:55:15.153450,1244,91,0.001426,0
1150847240,TheMinescout/terra-cotta-game-suite,https://github.com/TheMinescout/terra-cotta-game-suite,0,"A single-file HTML5 arcade collection featuring P2P Multiplayer Tic-Tac-Toe, Snake, Minesweeper, and more in a minimalist design.",HTML,"['generated', 'html5-games', 'javascript', 'minimalist', 'multiplayer', 'peerjs', 'single-file', 'tic-tac-toe']",silent,205,5,比较不同AI模型生成单文件HTML5游戏的能力,产品与系统原型,entertainment,4,该项目反映了AI原生开发趋势，通过标准化提示词对比LLMs的代码生成能力，展示了AI在快速原型构建和娱乐应用中的潜力。,2026-02-11T10:55:15.366436,2690,103,0.002896,0
1150249825,CharmsBot/Charmsbot-site,https://github.com/CharmsBot/Charmsbot-site,0,,HTML,[],silent,635,2,为Tibia玩家优化狩猎伤害计算,产品与系统原型,entertainment,4,该项目反映了游戏社区工具向专业化、算法化发展的趋势，将学术优化算法（匈牙利算法）应用于游戏场景，体现了游戏工具从简单脚本向复杂系统演进的微观趋势。,2026-02-11T10:55:18.468825,2871,112,0.003095,0
1150319347,melat33/Birhan-Energies-Brent-Oil-Analysis,https://github.com/melat33/Birhan-Energies-Brent-Oil-Analysis,0,,Jupyter Notebook,[],silent,3260,2,分析布伦特油价变化点并提供可视化,产品与系统原型,fintech,4,该项目反映了数据科学工具向交互式产品化发展的趋势，将学术研究方法（贝叶斯变化点检测）转化为面向投资者的实用决策工具，体现了金融科技领域对可操作洞察的需求增长。,2026-02-11T10:55:19.191914,2980,115,0.00321,0
1150714926,jeanpool1937/scheduler-app,https://github.com/jeanpool1937/scheduler-app,0,,Python,[],silent,555,1,优化钢铁厂生产排程,产品与系统原型,business_automation,5,该项目反映了制造业数字化转型中，将复杂业务规则（如停机时间计算）通过前端技术栈（React/TypeScript）实现可视化与自动化的趋势，体现了低代码/无代码工具向垂直行业深度定制化发展的方向。,2026-02-11T10:55:19.490286,3287,121,0.003529,0
1150162995,hey-codes/paperterm,https://github.com/hey-codes/paperterm,0,A terminal-aesthetic dashboard for jailbroken Kindle e-readers,Python,[],silent,11702,1,为越狱Kindle提供终端风格仪表盘,个人效能与辅助工具,personal,3,该项目反映了边缘计算与物联网设备个性化定制的趋势，通过自动化工作流将传统电子阅读器转变为信息展示终端，体现了开发者对硬件二次利用和DIY文化的探索。,2026-02-11T10:55:19.873613,2264,107,0.002478,0
1150507999,Masterplan16/Friday-2.0,https://github.com/Masterplan16/Friday-2.0,0,,Python,[],silent,1589,3,构建个人多代理AI助手系统,产品与系统原型,personal,5,该项目体现了AI代理架构从企业级向个人化迁移的趋势，结合LangGraph、多模块专业化与本地化部署，反映了开发者对隐私、成本控制与可扩展性的高度关注。,2026-02-11T10:55:20.549836,4307,110,0.004527,0
1150980004,gbrl23/dindin,https://github.com/gbrl23/dindin,0,Repositório do sistema financeiro Dindin,JavaScript,[],silent,3635,1,跟踪个人与共享财务支出,产品与系统原型,personal,4,该项目反映了低代码/无代码趋势下，开发者利用云服务（如Supabase）快速构建全栈应用，以简化个人财务管理系统的开发流程。,2026-02-11T10:55:23.012237,2279,98,0.002475,0
1150827395,programingfrik/olivia,https://github.com/programingfrik/olivia,0,"Un ejemplo de una aplicación creada con django, una agenda de contactos.",Python,[],silent,643,1,管理个人联系人信息,产品与系统原型,personal,3,该项目反映了开发者使用传统框架（如Django）构建基础Web应用以学习或演示的趋势，体现了开源社区中教育性示例项目的持续需求。,2026-02-11T10:55:23.725380,1315,99,0.001513,0
1150870018,Lorenzo05-creator/laravel10,https://github.com/Lorenzo05-creator/laravel10,0,,PHP,[],silent,84,1,Laravel框架的官方文档副本,基础设施与底层组件,other,1,反映了开发者通过复制官方框架文档来快速创建个人学习仓库的轻量化实践，体现了开源生态中模板化复制的低门槛入门趋势。,2026-02-11T10:55:24.170286,2252,102,0.002456,0
1150852349,lcassin/Mermaid_Editor,https://github.com/lcassin/Mermaid_Editor,0,An IDE editor to design and edit mermaid charts and markup files,C#,[],silent,27865,1,可视化编辑Mermaid图表和Markdown文件,个人效能与辅助工具,productivity,4,该项目反映了开发者工具向可视化、低代码方向演进的趋势，通过集成成熟的渲染引擎（如Mermaid.js）和编辑器组件（如AvalonEdit），快速构建专业级桌面应用，降低了图表和文档编辑的技术门槛。,2026-02-11T10:55:24.449568,3488,124,0.003736,0
1150505826,perviz24/wiseflow-question-generator,https://github.com/perviz24/wiseflow-question-generator,0,,TypeScript,[],silent,555,5,基于Next.js模板的快速启动项目,产品与系统原型,other,1,反映了AI辅助开发工具（如Vercel AI模板）降低项目启动门槛的趋势，开发者更关注快速原型验证而非从零构建。,2026-02-11T10:55:25.464349,1611,101,0.001813,0
1150479102,guduru-bhargav/hobby-dating,https://github.com/guduru-bhargav/hobby-dating,0,,JavaScript,[],silent,415,5,创建React Vite模板项目,基础设施与底层组件,other,1,该项目反映了AI辅助开发工具（如Vite模板生成器）的普及，降低了前端项目启动门槛，体现了软件开发生态中模板化和自动化配置的微观趋势。,2026-02-11T10:55:27.084746,1518,102,0.001722,0
1150960940,aaronmpng/Japanese-restaurant-website,https://github.com/aaronmpng/Japanese-restaurant-website,0,,JavaScript,[],silent,9722,1,为日本餐厅构建展示网站,产品与系统原型,ecommerce,3,该项目反映了小型企业通过开源技术快速构建在线展示平台的趋势，利用React和Vite等现代前端工具简化开发流程，以低成本满足客户需求。,2026-02-11T10:55:28.436374,1267,99,0.001465,0
1150163915,gdeaxx-pixel/dividend-analyzer,https://github.com/gdeaxx-pixel/dividend-analyzer,0,,Python,[],silent,118,1,分析股息投资组合与策略,产品与系统原型,fintech,3,该项目反映了金融科技领域低代码工具（如Streamlit）的普及，使开发者能快速构建交互式数据分析应用，降低金融分析门槛。,2026-02-11T10:55:28.947072,1585,97,0.001779,0
1150801736,djagla/badminton-lider,https://github.com/djagla/badminton-lider,0,Wordpress theme for Badminton Lider Wieliczka,CSS,[],silent,427,1,为羽毛球俱乐部创建WordPress主题,产品与系统原型,entertainment,2,反映了WordPress生态中基于官方工具（Create Block）快速生成定制化主题的轻量化开发趋势，体现了特定兴趣社区（如体育俱乐部）对低成本数字化展示的需求。,2026-02-11T10:55:29.397960,1696,110,0.001916,0
1150655657,IggyNunez/Kalyxi-AI-Powered-Sales-Call-Analysis-Platform,https://github.com/IggyNunez/Kalyxi-AI-Powered-Sales-Call-Analysis-Platform,0,,TypeScript,[],silent,71056,3,分析销售通话以提供AI洞察,产品与系统原型,business_automation,5,该项目反映了AI在企业级自动化中的渗透趋势，将生成式AI（如GPT-4）与传统业务系统（如CRM）结合，以提升销售效率和数据驱动决策。,2026-02-11T10:55:30.632625,4238,106,0.00445,0
1150576239,itz-aravind-kumar/G-Nex,https://github.com/itz-aravind-kumar/G-Nex,0,,Java,[],silent,127,3,演示微服务架构面试项目,产品与系统原型,education,4,反映了技术面试准备向完整可运行系统原型演进的趋势，开发者通过构建生产级项目来展示架构设计能力而非仅理论回答。,2026-02-11T10:55:31.456890,2343,99,0.002541,0
1150701045,boxfox1/web.boxfox1.com,https://github.com/boxfox1/web.boxfox1.com,0,"Boxfox1 web platform – design, hosting and digital presence.",HTML,[],silent,1235,1,展示公司网站以吸引客户,产品与系统原型,other,2,该项目反映了小型企业或自由职业者利用静态网站技术（如HTML/CSS/JS）快速构建低成本、高性能在线展示平台的趋势，强调轻量化和SEO优化，以应对数字营销需求。,2026-02-11T10:55:32.947076,1626,108,0.001842,0
1150906279,josephthampy/quadracollective,https://github.com/josephthampy/quadracollective,0,,JavaScript,[],silent,23960,1,在线销售艺术品的电商平台,产品与系统原型,ecommerce,4,该项目反映了MERN栈在快速构建全栈电商原型中的持续流行，以及开发者对艺术品等垂直电商领域的兴趣，体现了低代码/无头CMS之外的传统全栈开发趋势。,2026-02-11T10:55:33.688736,1647,106,0.001859,0
1150796153,mrstk123/PharmacyStock,https://github.com/mrstk123/PharmacyStock,0,,C#,[],silent,139,3,药店库存管理与监控系统,产品与系统原型,health,5,该项目反映了企业级应用向现代化、容器化架构迁移的趋势，以及医疗健康领域对实时数据管理和自动化监控的强烈需求。,2026-02-11T10:55:33.724492,3898,96,0.00409,0
1150886437,Gahroot/AWPContract,https://github.com/Gahroot/AWPContract,0,,TypeScript,[],silent,10847,5,创建Next.js应用模板,基础设施与底层组件,other,1,该项目反映了AI原生开发工具（如Vercel AI SDK）的普及，使得开发者能快速生成标准化项目模板，加速原型构建。,2026-02-11T10:55:34.447578,1604,94,0.001792,0
1150797739,ironsignalworks/fanzinator,https://github.com/ironsignalworks/fanzinator,0,,TypeScript,[],silent,240,1,浏览器内图形编辑与导出,产品与系统原型,content_creation,4,反映了低代码/无代码工具向专业内容创作领域渗透的趋势，以及浏览器作为完整应用平台的成熟度提升。,2026-02-11T10:55:35.841182,1630,96,0.001822,0
1150876110,macerti/e-qms,https://github.com/macerti/e-qms,1,,TypeScript,[],silent,773,1,构建质量管理系统前端界面,产品与系统原型,business_automation,4,该项目反映了企业级SaaS工具向轻量级、模块化前端发展的趋势，结合现代技术栈如Vite和React，以降低部署和维护成本。,2026-02-11T10:55:38.128678,1944,101,0.002146,0
1150680067,Sonukr2006/Shuggi,https://github.com/Sonukr2006/Shuggi,1,,JavaScript,[],silent,18867,3,构建本地运行的AI虚拟人助手,产品与系统原型,entertainment,4,该项目反映了AI应用向本地化、隐私保护方向发展的趋势，同时结合了3D虚拟形象与语音交互，体现了多模态AI交互的集成化探索。,2026-02-11T10:55:38.447369,2228,107,0.002442,0
1150313339,mioNacs/Ambria,https://github.com/mioNacs/Ambria,0,Manage Open Source Contributions in Natural Language.,TypeScript,[],silent,940,3,用自然语言管理GitHub仓库操作,产品与系统原型,productivity,4,该项目体现了AI代理从代码生成向工作流编排的演进趋势，将大语言模型与特定领域工具（GitHub API）深度集成，形成可交互的智能操作界面。,2026-02-11T10:55:38.500342,2472,111,0.002694,0
1150526805,Pankajgour12/AI-Chatbot-Anyone-Embed,https://github.com/Pankajgour12/AI-Chatbot-Anyone-Embed,0, I build a Production-ready AI Customer Support Chatbot that anyone can Embed on their Website,TypeScript,[],silent,588,5,将AI客服聊天机器人嵌入网站,产品与系统原型,business_automation,3,该项目反映了AI工具在降低企业自动化门槛方面的趋势，使非技术用户能快速部署客服解决方案，推动AI驱动的业务效率提升。,2026-02-11T10:55:38.882826,1638,98,0.001834,0
1150156682,d3rk99/OW_HeroBans_OBSTool,https://github.com/d3rk99/OW_HeroBans_OBSTool,0,,JavaScript,[],silent,1208,1,为《守望先锋2》自定义比赛提供英雄禁用显示工具,个人效能与辅助工具,entertainment,2,该项目反映了游戏直播生态中轻量级定制工具的需求增长，开发者通过静态网页技术快速构建实用工具以增强直播互动体验。,2026-02-11T10:55:40.079256,1889,104,0.002097,0
1150693659,FDJTS/Infiniware11,https://github.com/FDJTS/Infiniware11,0,Website of Infiniware company,HTML,[],silent,29674,1,构建公司官网,产品与系统原型,other,2,该项目反映了开发者对简约、无框架前端和云后端集成的偏好，体现了现代Web开发中追求轻量级、高效能工具的趋势。,2026-02-11T10:55:42.722801,1406,93,0.001592,0
1150624879,kjhk3082/kjhk3082,https://github.com/kjhk3082/kjhk3082,0,My GitHub Profile README,,[],silent,53,2,展示个人开发者简介与技能,个人效能与辅助工具,personal,1,该项目反映了开发者通过GitHub Profile README作为个人品牌展示平台的趋势，利用动态可视化工具增强个人技术形象，体现了开源社区中个人专业身份构建的微观趋势。,2026-02-11T10:55:42.820860,2786,107,0.003,0
1150231158,q7jxb7yxdk-star/news-aggregator,https://github.com/q7jxb7yxdk-star/news-aggregator,0,Grab News,HTML,[],silent,277,3,从多个网站抓取新闻并整理,个人效能与辅助工具,research,3,该项目反映了开发者对传统爬虫工具进行现代化重构的趋势，通过引入OOP设计、错误处理机制和配置管理，将简单的脚本升级为可维护的工程化工具，体现了个人开发者对代码质量的重视。,2026-02-11T10:55:43.029893,2968,118,0.003204,0
1150548536,Xposed-Modules-Repo/dev.fzer0x.imsicatcherdetector2,https://github.com/Xposed-Modules-Repo/dev.fzer0x.imsicatcherdetector2,5,Sentry Radio,,"['android', 'android-root', 'lsposed', 'lsposed-module', 'xposed', 'xposed-framework', 'xposed-module']",silent,54,1,检测安卓手机伪基站与网络攻击,产品与系统原型,research,5,该项目反映了移动安全领域向深度系统集成与实时威胁检测的演进趋势，结合了硬件级控制、多源数据验证与离线地图等复杂功能，体现了开源社区在专业安全工具开发上的高度专业化。,2026-02-11T10:55:43.900295,3786,117,0.00402,0
1150858653,zbysekmartoch/measure,https://github.com/zbysekmartoch/measure,0,Modular Extensible Analytical Stack - UOHS Research Environment,JavaScript,[],silent,2333,1,为研究人员提供一体化数据分析工作台,产品与系统原型,research,5,反映了学术界对一体化、可扩展分析平台的需求增长，以及现代Web技术栈在专业研究工具中的普及趋势。,2026-02-11T10:55:44.446723,2319,95,0.002509,0
1150812132,eduardo-weise/wedding-page,https://github.com/eduardo-weise/wedding-page,0,,SCSS,[],silent,1365,1,为个人婚礼创建移动优先的展示页面,产品与系统原型,personal,3,该项目反映了开发者利用现代前端框架（如Angular）快速构建个人生活场景应用的微观趋势，体现了低代码/轻量级产品原型的普及化。,2026-02-11T10:55:47.356682,2460,106,0.002672,0
1150794319,HrithikRaj1999/SpendSenseAI,https://github.com/HrithikRaj1999/SpendSenseAI,0,,TypeScript,[],silent,593,2,个人支出管理与智能分析,产品与系统原型,personal,5,该项目反映了现代软件工程向模块化、类型安全与AI辅助业务逻辑的融合趋势，展示了从传统单体应用向微服务架构演进的实践。,2026-02-11T10:55:47.516410,4763,101,0.004965,0
1150808693,moheshaimi-beep/security-guard-deploy,https://github.com/moheshaimi-beep/security-guard-deploy,0,,JavaScript,[],silent,3542,1,安保人员考勤与管理系统,产品与系统原型,business_automation,5,该项目反映了企业级自动化向移动端和实时数据整合的微观趋势，结合人脸识别和地理定位技术提升传统行业的管理效率。,2026-02-11T10:55:47.663738,3259,97,0.003453,0
1150898478,oliveirasouza/javaScript,https://github.com/oliveirasouza/javaScript,0,,JavaScript,[],silent,1564,1,学习或练习JavaScript编程,基础设施与底层组件,education,1,该项目反映了开发者通过创建基础代码库来学习和分享编程技能的趋势，体现了开源社区中个人学习与知识传播的微观生态。,2026-02-11T10:55:48.336077,1210,92,0.001394,0
1150661612,rkrichard91/azurapp,https://github.com/rkrichard91/azurapp,0,,JavaScript,[],silent,140,1,为企业客户提供报价计算工具,产品与系统原型,business_automation,4,该项目反映了企业级SaaS工具向轻量化、模块化前端应用迁移的趋势，利用现代React栈和云数据库（Supabase）快速构建内部业务自动化系统，降低传统CRM定制成本。,2026-02-11T10:55:48.578702,2265,114,0.002493,0
1150747680,fahruhernan-dotcom/internal-epanen,https://github.com/fahruhernan-dotcom/internal-epanen,0,,Vue,[],silent,26564,1,农业企业内部管理与监控系统,产品与系统原型,business_automation,4,该项目反映了农业科技领域向数字化转型的趋势，通过整合前端仪表板、后端自动化工作流和数据库管理，展示了企业级SaaS解决方案在传统行业的应用潜力。,2026-02-11T10:55:52.095244,1974,106,0.002186,0
1150985849,bkaewell/cloudflare-verified-ddns,https://github.com/bkaewell/cloudflare-verified-ddns,1,"Lightweight, reliable Dynamic DNS updater for Cloudflare. Automatically detects your public IP and updates DNS records with verification. Built in Python, container-ready (Docker), minimal footprint. Perfect for home servers, VPNs, self-hosting, and edge deployments.",Python,[],silent,468,1,自动更新家庭网络动态DNS记录,个人效能与辅助工具,personal,4,该项目反映了开发者将企业级分布式系统设计模式（如Kubernetes控制器、状态机）应用于个人家庭网络场景的微观趋势，体现了边缘计算和自主运维在消费级硬件上的实践。,2026-02-11T10:55:52.122393,3380,113,0.003606,0
